question_number,question,option_A,option_B,option_C,option_D,answer,explanation
45,"A new insurance agent tells his client that he has bound coverage on his home. However, he did not follow through with binding coverage making it an ineligible risk. His home burns down. Where can the homeowner seek coverage?",The agent's professional liability policy,The agent's general liability policy,The agent's personal umbrella policy,The mortgage company who required home insurance,A,"The agent's professional liability policy, aka the ""errors and omissions policy."" General liability and personal liability policies do not respond to professional liability claims. The mortgage company has no negligence in this situation and is not responsible."
46,"Mr. Smith found out that an employee had been stealing money from the cash register. Fortunately, Mr. Smith had purchased a bond that protected his business from this type of criminal activity. What kind of bond did Mr. Smith purchase?",Surety bond,Fidelity bond,Agency bond,Convertible bond,B,"Fidelity means faithful or loyal. A fidelity bond protects business owners against dishonest acts by their employees. This includes fraud, embezzlement, misappropriation, wrongful conversion, larceny, willful misapplication, theft, and other acts of dishonesty. A surety bond is a contract between the surety, principal, and obligee to ensure that a contract will be fulfilled. An agency bond is a bond issued by a government body that finances activities that are related to public purposes. A convertible bond is fixed-income debt security that can be converted into equity shares or common stock and pays interest."
47,A farm owner's policy covers all of the following except:,The farmer's home,The farmer's personal property and liability,The farming operation's property and liability,Crops growing in the field,A,"In most cases, the farmer's home is located on the farm property. A farm owner's policy is designed to protect the farmer's property and liability for their home and their farming operations. The farmer's spouse and children would also be covered as insureds under a farm owner's policy. Farmers must purchase crop insurance to cover crops growing in fields."
48,A customer entered the garage of an auto mechanic shop to speak to a mechanic about their car. The customer slipped and fell on an oil spill and had to be taken to the emergency room for treatment. What type of commercial insurance would have covered this type of loss?,Garage liability,Garage keepers insurance,Medical payments,Commercial auto insurance,A,"Garage liability covers others for bodily injury due to an accident on company property. By contrast, garage keepers insurance covers someone else's autos or other property while it is in the care of the garage owner. Medical payments refers to coverage a business owner can add onto a commercial auto policy to cover the driver and passengers of a commercial vehicle."
49,What are the three parties to a bond?,"The obligee, surety and the principal","The shipper, the consignee and the carrier","The insured, the insurer and a third party","A contractor, subcontractor and the insurance company",A,"The obligee is the party who requires someone to get a surety bond. The principal is the person who is obligated to a creditor, and the surety is the person who is responsible for paying if the principal defaults on payment or agreed actions. A shipper ships goods, a carrier transports them, and a consignee is the final recipient of goods. The insured is the party being insured; the insurer is the insurance company; and a third party is anyone else. A contractor is a person hired to perform tasks for a construction project; a subcontractor is hired by a contractor; and the insurance company may insure them both."
50,A business owner learned that the government would be shutting down the road to his business for several weeks for road construction. The business was located on a dead-end street and customers would not be able to reach the business during the construction. What type of commercial insurance would protect the business?,Employment practices liability,Ordinance or law,Business interruption,Commercial general liability,,"Score My P ractice Test Testscom Video P & C  (P ro p e r ty  &  C a s u a lty )  In s u ra n c e  A g e n t P P & C  (P ro p e r ty  &  C a s u a lty )  In s u ra n c e  A g e n t P Watch on Robert Cherris, CPU, ASF, ARC, is an insurance agent from Michigan with over forty years of experience in the industry, He formerly was a faculty instructor at Florida Atlant... more Business interruption insurance is also known as business income insurance. It pays for losses where a business must temporarily close due to a covered loss. It may cover loss of revenue, mortgage/rent/lease payments, taxes, payroll, relocation, extra expenses, and training costs. Employment practices liability refers to insurance coverage that pays for losses where workers claim the company violated their rights. Ordinance or law coverage pays for the increased costs of repairing or rebuilding a building after a covered loss to meet the current building codes. Commercial general liability pays for losses due to bodily injury, property damage, and personal injury when caused by a business's products or operations or injuries that happen on company property. Property & Casualty Insurance Practice Test• Property & Casualty Insurance Test Guide• Property & Casualty Insurance Flash Cards• Property & Casualty Insurance Exam FAQs• Charles Siniari, is an instructor in Property & Casualty insurance at PeopleShare in Pennsylvania. Denise Jackson, is an insurance instructor in Property & Casualty insurance as well as other types of insurance at Dee's Prelicensing Bootcamp in Florida. ... more How do I study for a property and casualty insurance exam? Practice tests and flash cards are an effective way to study for a property and casualty insurance licensing exam.  They help you learn the subject matter and practice your test taking skills. Property and casualty insurance agent exams are taken on a computer, so practicing with online practice tests can boost your chance of success. What is on a property and casualty insurance exam? Insurance agents who wish to sell property and casualty insurance are required to possess the proper license for each state in which they conduct business. In order to obtain a P&C insurance license, individuals must take and successfully pass an exam that is offered by the state licensing boards.  State property and casualty insurance exams are typically 150 questions long and cover the following topics: General insurance Insurance regulation Homeowners insurance Commercial policies Automobile insurance Inland Marine policies Flood Insurance Professional Liability Workers Compensation Policy Provisions Contracts the country and is not specific to any one state but rather applicable to all states. Our exam is based on ISO standard policies. About Us Contact Sitemap Login Copyright © 2009-2025"
